{
  "spec_version": "1.0.0",
  "theory_profile": "chanlun_108_strict",
  "price_unit": "integer_ticks",
  "floating_epsilon_allowed": false,
  "pipeline": [
    "raw_kline",
    "sequential_directional_inclusion",
    "processed_kline",
    "fractal_detection",
    "same_type_fractal_reduction",
    "bi_assembly",
    "bi_state_update"
  ],
  "state_machine": {
    "encoding": {
      "UP_EXTENDING": [1, 1],
      "UP_TOP_FRACTAL_BUILDING": [1, 0],
      "DOWN_EXTENDING": [-1, 1],
      "DOWN_BOTTOM_FRACTAL_BUILDING": [-1, 0]
    },
    "allowed_transitions": {
      "UP_EXTENDING": ["UP_TOP_FRACTAL_BUILDING"],
      "UP_TOP_FRACTAL_BUILDING": ["UP_EXTENDING", "DOWN_EXTENDING"],
      "DOWN_EXTENDING": ["DOWN_BOTTOM_FRACTAL_BUILDING"],
      "DOWN_BOTTOM_FRACTAL_BUILDING": ["DOWN_EXTENDING", "UP_EXTENDING"]
    },
    "source_rule": "L91_STATE"
  },
  "cases": [
    {
      "id": "L62_F1_TOP_FRACTAL",
      "title": "三根无包含K线构成顶分型",
      "category": "fractal_detection",
      "source": {
        "lesson": 62,
        "page": "https://chanlun108.cn/chanzhongshuochan108ke/62.html",
        "image": "assets/original/lesson62.jpg",
        "region_id": "L62_F1",
        "evidence": "image_and_text"
      },
      "input": {
        "processed_klines": [
          {"id": "k0", "high": 10, "low": 5},
          {"id": "k1", "high": 12, "low": 7},
          {"id": "k2", "high": 11, "low": 6}
        ]
      },
      "expected": {
        "fractals": [
          {"type": "top", "center": "k1", "price": 12, "members": ["k0", "k1", "k2"]}
        ]
      }
    },
    {
      "id": "L62_F2_BOTTOM_FRACTAL",
      "title": "三根无包含K线构成底分型",
      "category": "fractal_detection",
      "source": {
        "lesson": 62,
        "page": "https://chanlun108.cn/chanzhongshuochan108ke/62.html",
        "image": "assets/original/lesson62.jpg",
        "region_id": "L62_F2",
        "evidence": "image_and_text"
      },
      "input": {
        "processed_klines": [
          {"id": "k0", "high": 11, "low": 6},
          {"id": "k1", "high": 9, "low": 4},
          {"id": "k2", "high": 10, "low": 5}
        ]
      },
      "expected": {
        "fractals": [
          {"type": "bottom", "center": "k1", "price": 4, "members": ["k0", "k1", "k2"]}
        ]
      }
    },
    {
      "id": "L62_F3_SHARED_K_INVALID_BI",
      "title": "顶底分型共用K线时拒绝成笔",
      "category": "bi_assembly",
      "source": {
        "lesson": 62,
        "page": "https://chanlun108.cn/chanzhongshuochan108ke/62.html",
        "image": "assets/original/lesson62.jpg",
        "region_id": "L62_F3",
        "evidence": "image_and_text"
      },
      "input": {
        "processed_klines": [
          {"id": "k0", "high": 10, "low": 5},
          {"id": "k1", "high": 12, "low": 8},
          {"id": "k2", "high": 11, "low": 4},
          {"id": "k3", "high": 8, "low": 2},
          {"id": "k4", "high": 9, "low": 3}
        ],
        "endpoint_fractals": [
          {"type": "top", "center": "k1", "members": ["k0", "k1", "k2"]},
          {"type": "bottom", "center": "k3", "members": ["k2", "k3", "k4"]}
        ]
      },
      "expected": {
        "completed_bi": [],
        "rejected": true,
        "reject_reason": "endpoint_fractals_share_processed_kline"
      }
    },
    {
      "id": "L62_F4_NO_FREE_K_INVALID_BI",
      "title": "端点分型间无独立K线时拒绝成笔",
      "category": "bi_assembly",
      "source": {
        "lesson": 62,
        "page": "https://chanlun108.cn/chanzhongshuochan108ke/62.html",
        "image": "assets/original/lesson62.jpg",
        "region_id": "L62_F4",
        "evidence": "image_and_text"
      },
      "input": {
        "processed_klines": [
          {"id": "k0", "high": 10, "low": 5},
          {"id": "k1", "high": 12, "low": 8},
          {"id": "k2", "high": 11, "low": 6},
          {"id": "k3", "high": 9, "low": 4},
          {"id": "k4", "high": 7, "low": 2},
          {"id": "k5", "high": 8, "low": 3}
        ],
        "endpoint_fractals": [
          {"type": "top", "center": "k1", "members": ["k0", "k1", "k2"]},
          {"type": "bottom", "center": "k4", "members": ["k3", "k4", "k5"]}
        ]
      },
      "expected": {
        "completed_bi": [],
        "rejected": true,
        "reject_reason": "no_independent_processed_kline_between_endpoint_fractals"
      }
    },
    {
      "id": "L62_F5_MINIMAL_VALID_DOWN_BI",
      "title": "一个独立K线构成最小有效向下笔",
      "category": "bi_assembly",
      "source": {
        "lesson": 62,
        "page": "https://chanlun108.cn/chanzhongshuochan108ke/62.html",
        "image": "assets/original/lesson62.jpg",
        "region_id": "L62_F5",
        "evidence": "image_and_text"
      },
      "input": {
        "processed_klines": [
          {"id": "k0", "high": 10, "low": 5},
          {"id": "k1", "high": 12, "low": 8},
          {"id": "k2", "high": 11, "low": 6},
          {"id": "k3", "high": 10, "low": 5},
          {"id": "k4", "high": 9, "low": 4},
          {"id": "k5", "high": 7, "low": 2},
          {"id": "k6", "high": 8, "low": 3}
        ]
      },
      "expected": {
        "completed_bi": [
          {
            "direction": "down",
            "start": {"fractal": "top", "center": "k1", "price": 12},
            "end": {"fractal": "bottom", "center": "k5", "price": 2}
          }
        ]
      }
    },
    {
      "id": "L62_F5_MINIMAL_VALID_UP_BI",
      "title": "一个独立K线构成最小有效向上笔",
      "category": "bi_assembly",
      "source": {
        "lesson": 62,
        "page": "https://chanlun108.cn/chanzhongshuochan108ke/62.html",
        "image": "assets/original/lesson62.jpg",
        "region_id": "L62_F5",
        "evidence": "mirrored_image_rule"
      },
      "input": {
        "processed_klines": [
          {"id": "k0", "high": 8, "low": 3},
          {"id": "k1", "high": 7, "low": 2},
          {"id": "k2", "high": 9, "low": 4},
          {"id": "k3", "high": 10, "low": 5},
          {"id": "k4", "high": 11, "low": 6},
          {"id": "k5", "high": 12, "low": 8},
          {"id": "k6", "high": 10, "low": 5}
        ]
      },
      "expected": {
        "completed_bi": [
          {
            "direction": "up",
            "start": {"fractal": "bottom", "center": "k1", "price": 2},
            "end": {"fractal": "top", "center": "k5", "price": 12}
          }
        ]
      }
    },
    {
      "id": "L62_F6_UP_INCLUSION",
      "title": "向上包含取较高高点与较高低点",
      "category": "inclusion_processing",
      "source": {
        "lesson": 62,
        "page": "https://chanlun108.cn/chanzhongshuochan108ke/62.html",
        "image": "assets/original/lesson62.jpg",
        "region_id": "L62_F6",
        "evidence": "image_and_text"
      },
      "input": {
        "direction": "up",
        "raw_klines": [
          {"id": "r0", "high": 10, "low": 5},
          {"id": "r1", "high": 12, "low": 7},
          {"id": "r2", "high": 11, "low": 8}
        ],
        "merge_pair": ["r1", "r2"]
      },
      "expected": {
        "merged_kline": {
          "high": 12,
          "low": 8,
          "members": ["r1", "r2"],
          "high_source": "r1",
          "low_source": "r2"
        }
      }
    },
    {
      "id": "L62_F6_DOWN_INCLUSION",
      "title": "向下包含取较低高点与较低低点",
      "category": "inclusion_processing",
      "source": {
        "lesson": 62,
        "page": "https://chanlun108.cn/chanzhongshuochan108ke/62.html",
        "image": "assets/original/lesson62.jpg",
        "region_id": "L62_F6",
        "evidence": "image_and_text"
      },
      "input": {
        "direction": "down",
        "raw_klines": [
          {"id": "r0", "high": 12, "low": 7},
          {"id": "r1", "high": 10, "low": 5},
          {"id": "r2", "high": 9, "low": 6}
        ],
        "merge_pair": ["r1", "r2"]
      },
      "expected": {
        "merged_kline": {
          "high": 9,
          "low": 5,
          "members": ["r1", "r2"],
          "high_source": "r2",
          "low_source": "r1"
        }
      }
    },
    {
      "id": "L62_F7_THREE_K_CLASSIFICATION",
      "title": "无包含三K的四种完全分类",
      "category": "fractal_detection",
      "source": {
        "lesson": 62,
        "page": "https://chanlun108.cn/chanzhongshuochan108ke/62.html",
        "image": "assets/original/lesson62.jpg",
        "region_id": "L62_F7",
        "evidence": "image_and_text"
      },
      "input": {
        "samples": {
          "rising": [[10, 5], [11, 6], [12, 7]],
          "top": [[10, 5], [12, 7], [11, 6]],
          "falling": [[12, 7], [11, 6], [10, 5]],
          "bottom": [[11, 6], [9, 4], [10, 5]]
        },
        "tuple_order": ["high", "low"]
      },
      "expected": {
        "classification": {
          "rising": "none",
          "top": "top",
          "falling": "none",
          "bottom": "bottom"
        }
      }
    },
    {
      "id": "L77_KEEP_LATER_HIGHER_TOP",
      "title": "无反向底分型时后顶更高替换前顶",
      "category": "same_type_fractal_reduction",
      "source": {
        "lesson": 77,
        "page": "https://chanlun108.cn/chanzhongshuochan108ke/77.html",
        "evidence": "text_rule"
      },
      "input": {
        "fractal_candidates": [
          {"id": "t1", "type": "top", "index": 3, "price": 12},
          {"id": "t2", "type": "top", "index": 7, "price": 14},
          {"id": "b1", "type": "bottom", "index": 12, "price": 5}
        ]
      },
      "expected": {
        "retained_fractals": ["t2", "b1"],
        "invalidated_fractals": ["t1"],
        "completed_bi": [{"direction": "down", "start": "t2", "end": "b1"}]
      }
    },
    {
      "id": "L77_KEEP_LATER_LOWER_BOTTOM",
      "title": "无反向顶分型时后底更低替换前底",
      "category": "same_type_fractal_reduction",
      "source": {
        "lesson": 77,
        "page": "https://chanlun108.cn/chanzhongshuochan108ke/77.html",
        "evidence": "text_rule"
      },
      "input": {
        "fractal_candidates": [
          {"id": "b1", "type": "bottom", "index": 3, "price": 5},